{"files":[{"bytes":45,"path":"artifacts/576cdd72-75ec-4d10-80d2-c9f2558dc55b/011797f6-4d76-41d8-a40b-ffc7499fed0a/captions.vtt","sha256":"11b0031252ec664662b8403d4951bb82f2347a8749d1de69e918f9a2d6d2f853"},{"bytes":424,"path":"artifacts/576cdd72-75ec-4d10-80d2-c9f2558dc55b/011797f6-4d76-41d8-a40b-ffc7499fed0a/clips/manifest.json","sha256":"b5f345d3c646bfa96f0cefa1e207d98c725e5ef8ccef8251260ff9133492b1d3"},{"bytes":79,"path":"artifacts/576cdd72-75ec-4d10-80d2-c9f2558dc55b/011797f6-4d76-41d8-a40b-ffc7499fed0a/clips/shot-1.mp4","sha256":"b2d2bd590eb81beaf3b0b78f1bc3757768b88e315f05dff8382da078d78ad74d"},{"bytes":81,"path":"artifacts/576cdd72-75ec-4d10-80d2-c9f2558dc55b/011797f6-4d76-41d8-a40b-ffc7499fed0a/export.mp4","sha256":"579a4ce673c5eeee19cb6d6e3b750934a30f5570b229b35151a3e92e6edf78c2"},{"bytes":88,"path":"artifacts/576cdd72-75ec-4d10-80d2-c9f2558dc55b/011797f6-4d76-41d8-a40b-ffc7499fed0a/hls/index.m3u8","sha256":"4b7762020e49ca5e0b08c0026272096cd80953e004044d9e8bb73a1145461bec"},{"bytes":57,"path":"artifacts/576cdd72-75ec-4d10-80d2-c9f2558dc55b/011797f6-4d76-41d8-a40b-ffc7499fed0a/provenance.json","sha256":"e6aa9f17b0cf3416af5ebf94d8897b25fcce3a0a7695f2adc9008d4328d062dd"},{"bytes":1869,"path":"queue/jobs.json","sha256":"77234957d96a75a931b352d124d39b1710b7ca45cb0f2a4a6ba50a97d0a5e6fe"},{"bytes":600,"path":"snapshot.json","sha256":"b3981058f34e54d1f71479402120fdcf80102e7d8b9f27c0b308620cdf111672"},{"bytes":434,"path":"state/cost-ledger.json","sha256":"a9785cce07d356f4fbf8c3009c39a37983eb6d83550f0189fbfcee4af9299fe9"},{"bytes":3,"path":"state/operator-review-queue.json","sha256":"37517e5f3dc66819f61f5a7bb8ace1921282415f10551d2defa5c3eb0985b570"},{"bytes":839,"path":"state/projects.json","sha256":"0d64a523f2ccc860604c0099b3080eb2485c9185c435a16ec5639a1a13f8347c"}],"projectId":"576cdd72-75ec-4d10-80d2-c9f2558dc55b","schema":"hv-project-archive/1","totalBytes":4519}